{
  "hero": {
    "eyebrow": "✠ Studio privé · Montréal ✠",
    "title": "Réservation",
    "script_sub": "votre couronne vous attend"
  },
  "reserv_section": {
    "eyebrow": "✠ Pour réserver ✠",
    "title": "Prendre rendez-vous"
  },
  "how_to": {
    "eyebrow": "✠ Système de réservation en ligne ✠",
    "title": "Réservez votre créneau"
  },
  "policies_section": {
    "eyebrow": "✠ À lire avant ✠",
    "title": "Politiques"
  },
  "policies": {
    "depot":     "Dépôt",
    "retard":    "Retard",
    "paiement":  "Paiement",
    "annulation": "Annulation"
  }
}
